{
  "artifact_count": 153,
  "input_manifest_sha256": "711f37c201b6cdddb328f83cb8097fb4e1e7cac3aeccb9dc041da6003d8890d8",
  "package_id": "d38beac0-8551-46aa-8095-b3c9dcc8f0a4",
  "production_contact": 0,
  "records": [
    {
      "artifact_id": "artifact-7e319f9111e61da8c1e3462a",
      "authority_classification": "CANONICAL_REPOSITORY_MIGRATION",
      "executable": false,
      "package_path": "canonical-migrations/046_access_core_recoverable_fulfillment.sql",
      "required_at_runtime": true,
      "runtime_use": "DEPLOYMENT_PAYLOAD_SOURCE",
      "sha256": "6f1b39fc66b53856e19475b20539de1377f20e29fe6ad99a79472c97dba2fe0c",
      "size": 163792,
      "source_path": "C:\\Importante\\Python\\tairet-mono-2\\infra\\sql\\migrations\\046_access_core_recoverable_fulfillment.sql"
    },
    {
      "artifact_id": "artifact-ec600a96995cd0f72b340f15",
      "authority_classification": "CANONICAL_REPOSITORY_MIGRATION",
      "executable": false,
      "package_path": "canonical-migrations/047_access_email_preclaim_terminal_failure.sql",
      "required_at_runtime": true,
      "runtime_use": "DEPLOYMENT_PAYLOAD_SOURCE",
      "sha256": "6bebbe803cc5c85094352bbcbc261df5ce26780fb1ae38d956089f48b67f20b4",
      "size": 46349,
      "source_path": "C:\\Importante\\Python\\tairet-mono-2\\infra\\sql\\migrations\\047_access_email_preclaim_terminal_failure.sql"
    },
    {
      "artifact_id": "artifact-43df93be739532db21d4bc32",
      "authority_classification": "CANONICAL_REPOSITORY_MIGRATION",
      "executable": false,
      "package_path": "canonical-migrations/048_access_email_preclaim_terminal_after_ambiguous.sql",
      "required_at_runtime": true,
      "runtime_use": "DEPLOYMENT_PAYLOAD_SOURCE",
      "sha256": "249a75c0da2f80a66e0d0717a88d8c4710cf51f210098078a375692fd4567532",
      "size": 24852,
      "source_path": "C:\\Importante\\Python\\tairet-mono-2\\infra\\sql\\migrations\\048_access_email_preclaim_terminal_after_ambiguous.sql"
    },
    {
      "artifact_id": "artifact-8b35475cc5facefa44c0676b",
      "authority_classification": "CANONICAL_REPOSITORY_MIGRATION",
      "executable": false,
      "package_path": "canonical-migrations/049_access_email_delivery_claim_correlation.sql",
      "required_at_runtime": true,
      "runtime_use": "DEPLOYMENT_PAYLOAD_SOURCE",
      "sha256": "cc3b71a988fafa3298344ec73731abc0ce8219c1dc35110e59916e5344f6d234",
      "size": 55698,
      "source_path": "C:\\Importante\\Python\\tairet-mono-2\\infra\\sql\\migrations\\049_access_email_delivery_claim_correlation.sql"
    },
    {
      "artifact_id": "artifact-c9b32ed83757ade9fa2b5f7d",
      "authority_classification": "APPROVED_SLICE_SPECIFIC_PREDECESSOR",
      "executable": false,
      "package_path": "development-rehearsal/fixtures/approved-predecessor/000_bootstrap.sql",
      "required_at_runtime": true,
      "runtime_use": "LOCAL_REHEARSAL_FIXTURE",
      "sha256": "42d11861423db60c597c13380991df5ac0a31aa1e6ac5e7b973bea1a6bf322ee",
      "size": 1169,
      "source_path": "C:\\Users\\mateo\\AppData\\Local\\Tairet\\statement-aware-atomic-migration-executor-v3-81648269\\frozen-release\\release\\fixtures\\approved-predecessor\\000_bootstrap.sql"
    },
    {
      "artifact_id": "artifact-9ffe0266e8bb50870fbf6287",
      "authority_classification": "APPROVED_SLICE_SPECIFIC_PREDECESSOR",
      "executable": false,
      "package_path": "development-rehearsal/fixtures/approved-predecessor/037_material_checkout_routine.sql",
      "required_at_runtime": true,
      "runtime_use": "LOCAL_REHEARSAL_FIXTURE",
      "sha256": "ebe658be9aa5ed99e9fec6cb16fc3ddf6422760eda85b787c581a11470f8d7c3",
      "size": 16065,
      "source_path": "C:\\Users\\mateo\\AppData\\Local\\Tairet\\statement-aware-atomic-migration-executor-v3-81648269\\frozen-release\\release\\fixtures\\approved-predecessor\\037_material_checkout_routine.sql"
    },
    {
      "artifact_id": "artifact-f1e092328626ecc70e40fb7b",
      "authority_classification": "APPROVED_SLICE_SPECIFIC_PREDECESSOR",
      "executable": false,
      "package_path": "development-rehearsal/fixtures/approved-predecessor/045_exact_checkin_routines.sql",
      "required_at_runtime": true,
      "runtime_use": "LOCAL_REHEARSAL_FIXTURE",
      "sha256": "ed8ab99b34b53adc72aaf61cff319e7a69ea5148dcac59cb7f88f5883d63da60",
      "size": 12558,
      "source_path": "C:\\Users\\mateo\\AppData\\Local\\Tairet\\statement-aware-atomic-migration-executor-v3-81648269\\frozen-release\\release\\fixtures\\approved-predecessor\\045_exact_checkin_routines.sql"
    },
    {
      "artifact_id": "artifact-b298f3ba507742cf3884ba37",
      "authority_classification": "APPROVED_SLICE_SPECIFIC_PREDECESSOR",
      "executable": false,
      "package_path": "development-rehearsal/fixtures/approved-predecessor/999_finalize.sql",
      "required_at_runtime": true,
      "runtime_use": "LOCAL_REHEARSAL_FIXTURE",
      "sha256": "95c5e32d4c23c757e1946ef01411ab739d43ec2b08a7eca0628646f260bacee5",
      "size": 1440,
      "source_path": "C:\\Users\\mateo\\AppData\\Local\\Tairet\\statement-aware-atomic-migration-executor-v3-81648269\\frozen-release\\release\\fixtures\\approved-predecessor\\999_finalize.sql"
    },
    {
      "artifact_id": "artifact-38021e4458d9e936df4447c4",
      "authority_classification": "APPROVED_SLICE_SPECIFIC_PREDECESSOR",
      "executable": false,
      "package_path": "development-rehearsal/fixtures/approved-predecessor/apply-order.txt",
      "required_at_runtime": true,
      "runtime_use": "LOCAL_REHEARSAL_FIXTURE",
      "sha256": "3b880f476c5e0131369edf9347528611d083bdd83e8c73c5878a3c952ceaeb6b",
      "size": 126,
      "source_path": "C:\\Users\\mateo\\AppData\\Local\\Tairet\\statement-aware-atomic-migration-executor-v3-81648269\\frozen-release\\release\\fixtures\\approved-predecessor\\apply-order.txt"
    },
    {
      "artifact_id": "artifact-d9fe3e167dc725ea9db0a8b9",
      "authority_classification": "APPROVED_SLICE_SPECIFIC_PREDECESSOR",
      "executable": false,
      "package_path": "development-rehearsal/fixtures/approved-predecessor/five_source_relations.sql",
      "required_at_runtime": true,
      "runtime_use": "LOCAL_REHEARSAL_FIXTURE",
      "sha256": "532b355f6426b3c9d2cba5bcb3dfaeaeb947db6776e71e2fb57defb509b14424",
      "size": 27423,
      "source_path": "C:\\Users\\mateo\\AppData\\Local\\Tairet\\statement-aware-atomic-migration-executor-v3-81648269\\frozen-release\\release\\fixtures\\approved-predecessor\\five_source_relations.sql"
    },
    {
      "artifact_id": "artifact-a7df768f01cdda241bbb6478",
      "authority_classification": "FROZEN_EXECUTOR_V3",
      "executable": false,
      "package_path": "executor-release/release/editable-source/package.json",
      "required_at_runtime": true,
      "runtime_use": "PACKAGE_EXECUTOR_AUTHORITY",
      "sha256": "f5adfc4b3921301409e6c12cba6750b6e22a371a9803b5df9bf89cdb2830fa2f",
      "size": 610,
      "source_path": "C:\\Users\\mateo\\AppData\\Local\\Tairet\\statement-aware-atomic-migration-executor-v3-81648269\\frozen-release\\release\\editable-source\\package.json"
    },
    {
      "artifact_id": "artifact-7e7f23d3e0fed1ff783bb6b3",
      "authority_classification": "FROZEN_EXECUTOR_V3",
      "executable": true,
      "package_path": "executor-release/release/editable-source/src/db/protocol-client.js",
      "required_at_runtime": true,
      "runtime_use": "PACKAGE_EXECUTOR_AUTHORITY",
      "sha256": "aa72ca8875e052a449d0408be2e04dadc118ab826c17feed8d3043465a038855",
      "size": 7991,
      "source_path": "C:\\Users\\mateo\\AppData\\Local\\Tairet\\statement-aware-atomic-migration-executor-v3-81648269\\frozen-release\\release\\editable-source\\src\\db\\protocol-client.js"
    },
    {
      "artifact_id": "artifact-cacfedc28b85b507f9e4f938",
      "authority_classification": "FROZEN_EXECUTOR_V3",
      "executable": true,
      "package_path": "executor-release/release/editable-source/src/db/scram.js",
      "required_at_runtime": true,
      "runtime_use": "PACKAGE_EXECUTOR_AUTHORITY",
      "sha256": "ddcea7e7f394ccf2a4b6e671ec0f89b60c02a9192aaccc4bc4f9e81650786058",
      "size": 3257,
      "source_path": "C:\\Users\\mateo\\AppData\\Local\\Tairet\\statement-aware-atomic-migration-executor-v3-81648269\\frozen-release\\release\\editable-source\\src\\db\\scram.js"
    },
    {
      "artifact_id": "artifact-380d6baab7fb84fab94dcd24",
      "authority_classification": "FROZEN_EXECUTOR_V3",
      "executable": true,
      "package_path": "executor-release/release/editable-source/src/envelope/validator.js",
      "required_at_runtime": true,
      "runtime_use": "PACKAGE_EXECUTOR_AUTHORITY",
      "sha256": "36bcc3bea4900a3fbae6d2a2f5f5317ffad9da44ffdd719c6e362d4e09b05661",
      "size": 2040,
      "source_path": "C:\\Users\\mateo\\AppData\\Local\\Tairet\\statement-aware-atomic-migration-executor-v3-81648269\\frozen-release\\release\\editable-source\\src\\envelope\\validator.js"
    },
    {
      "artifact_id": "artifact-9b2ec49d1b611049b7b13681",
      "authority_classification": "FROZEN_EXECUTOR_V3",
      "executable": true,
      "package_path": "executor-release/release/editable-source/src/executor/atomic-stage.js",
      "required_at_runtime": true,
      "runtime_use": "PACKAGE_EXECUTOR_AUTHORITY",
      "sha256": "84b9af6f9214dfebcd5fe079cdc1fcef35d3ec8189eed76c7bc0f61b705dad32",
      "size": 15834,
      "source_path": "C:\\Users\\mateo\\AppData\\Local\\Tairet\\statement-aware-atomic-migration-executor-v3-81648269\\frozen-release\\release\\editable-source\\src\\executor\\atomic-stage.js"
    },
    {
      "artifact_id": "artifact-40ca94fff98d3264d9e98c7d",
      "authority_classification": "FROZEN_EXECUTOR_V3",
      "executable": true,
      "package_path": "executor-release/release/editable-source/src/executor/invariant-guard.js",
      "required_at_runtime": true,
      "runtime_use": "PACKAGE_EXECUTOR_AUTHORITY",